{
  "schema_version": "1.0",
  "contract_id": "edge.worker.exchange/v1",
  "producer_module": "windows-edge-worker",
  "soul_id": "soul_aaaaaaaaaaaaaaaaaaaaaaaaaaaaaaaaaaaaaaaaaaaaaaaaaaaaaaaaaaaaaaaa",
  "device_binding_id": "db_bbbbbbbbbbbbbbbbbbbbbbbbbbbbbbbb",
  "platform_account_id": "pa_cccccccccccccccccccccccccccccccc",
  "trace_id": "trace_dddddddddddddddddddddddddddddddd",
  "idempotency_key": "idem_eeeeeeeeeeeeeeeeeeeeeeeeeeeeeeeeeeeeeeeeeeeeeeeeeeeeeeeeeeeeeeee",
  "occurred_at": "2026-07-14T00:00:01+00:00",
  "privacy_class": "personal",
  "exchange_kind": "RECEIPT",
  "command_id": "command-vector-1",
  "lease_id": null,
  "lease_expires_at": null,
  "request_sha256": "d7a8f4901c7d56f833b2ff24ea169bff565984a6417f165a4f25a5ff233d8d1e",
  "action_kind": null,
  "step_kind": null,
  "selector": null,
  "text": null,
  "wait_ms": null,
  "expected_postcondition": null,
  "shadow": false,
  "dispatch_acknowledged": true,
  "native_status": "SUCCESS",
  "postcondition_verified": true,
  "result_status": "VERIFIED_SUCCESS",
  "duplicate": false,
  "retry_allowed": false,
  "detail": "fixture state changed"
}
