{
  "schema_version": "1.0",
  "contract_id": "edge.worker.exchange/v1",
  "producer_module": "windows-edge-supervisor",
  "soul_id": "soul_aaaaaaaaaaaaaaaaaaaaaaaaaaaaaaaaaaaaaaaaaaaaaaaaaaaaaaaaaaaaaaaa",
  "device_binding_id": "db_bbbbbbbbbbbbbbbbbbbbbbbbbbbbbbbb",
  "platform_account_id": "pa_cccccccccccccccccccccccccccccccc",
  "trace_id": "trace_dddddddddddddddddddddddddddddddd",
  "idempotency_key": "idem_eeeeeeeeeeeeeeeeeeeeeeeeeeeeeeeeeeeeeeeeeeeeeeeeeeeeeeeeeeeeeeee",
  "occurred_at": "2026-07-14T00:00:00+00:00",
  "privacy_class": "personal",
  "exchange_kind": "COMMAND",
  "command_id": "command-vector-1",
  "lease_id": "lease-vector-1",
  "lease_expires_at": "2026-07-14T00:05:00+00:00",
  "request_sha256": "d7a8f4901c7d56f833b2ff24ea169bff565984a6417f165a4f25a5ff233d8d1e",
  "action_kind": "TYPE",
  "step_kind": "TYPE_TEXT",
  "selector": "fixture:input",
  "text": "hello\n世界",
  "wait_ms": null,
  "expected_postcondition": "fixture contains text",
  "shadow": true,
  "dispatch_acknowledged": null,
  "native_status": null,
  "postcondition_verified": null,
  "result_status": null,
  "duplicate": null,
  "retry_allowed": null,
  "detail": null
}
