{
  "schema_version": "1.0",
  "contract_id": "edge.worker.exchange/v1",
  "producer_module": "windows-edge-worker",
  "soul_id": "soul_aaaaaaaaaaaaaaaaaaaaaaaaaaaaaaaaaaaaaaaaaaaaaaaaaaaaaaaaaaaaaaaa",
  "device_binding_id": "db_bbbbbbbbbbbbbbbbbbbbbbbbbbbbbbbb",
  "platform_account_id": "pa_cccccccccccccccccccccccccccccccc",
  "trace_id": "trace_ffffffffffffffffffffffffffffffff",
  "idempotency_key": "idem_aaaaaaaaaaaaaaaaaaaaaaaaaaaaaaaaaaaaaaaaaaaaaaaaaaaaaaaaaaaaaaaa",
  "occurred_at": "2026-07-14T00:00:02+00:00",
  "privacy_class": "internal",
  "exchange_kind": "HEALTH",
  "command_id": null,
  "lease_id": null,
  "lease_expires_at": null,
  "request_sha256": null,
  "action_kind": null,
  "step_kind": null,
  "selector": null,
  "text": null,
  "wait_ms": null,
  "expected_postcondition": null,
  "shadow": false,
  "dispatch_acknowledged": null,
  "native_status": null,
  "postcondition_verified": null,
  "result_status": "HEALTHY",
  "duplicate": null,
  "retry_allowed": null,
  "detail": "worker healthy"
}
